<?xml version="1.0" encoding="ISO-8859-1"?>
<!DOCTYPE wrapper SYSTEM "wrapper.dtd">
<!-- author : dutka -->
<!-- date   : 2010-09-14 16:35:33 +0200 (Tue, 14 Sep 2010) -->

<wrapper>
  <library>

    <!-- The path of the shared object -->
    <path>poutre_fullspeed.so</path>



    <!-- This section describes all exchanges data between the wrapper and the platform -->
    <description>

      <!-- Those variables are substituted in the files above -->
      <!-- The order of variables is the order of the arguments of the function -->
      <variable-list>

        <!-- The definition of a variable -->
        <variable id="E" type="in" />
        <variable id="F" type="in" />
        <variable id="L" type="in" />
        <variable id="I" type="in" />


        <!-- The definition of a variable -->
        <variable id="d" type="out" />

      </variable-list>
      


      <!-- The function that we try to execute through the wrapper -->
      <function provided="yes">compute_deviation</function>

      <!-- the gradient is  defined  -->
      <gradient provided="no"></gradient>

      <!--  the hessian is  defined  -->
      <hessian provided="no"></hessian>

    </description>


  </library>

  <external-code>
    <!-- Those data are external to the platform (input files, etc.)-->
    <data></data>

    <wrap-mode type="static-link" state="shared">
      <in-data-transfer mode="arguments" />
      <out-data-transfer mode="arguments" />
    </wrap-mode>

    <command># no command</command>

    <user-prefix>poutreComputeDeviation</user-prefix>

  </external-code>

</wrapper>
