<?xml version="1.0" encoding="ISO-8859-1"?>
<!DOCTYPE wrapper SYSTEM "wrapper.dtd">
<!-- author : dutka -->
<!-- date   : 2008-06-26 13:50:17 +0200 (Thu, 26 Jun 2008) -->

<wrapper>
  <library>

    <!-- The path of the shared object -->
    <path>external_code_threads.so</path>



    <!-- This section describes all exchanges data between the wrapper and the platform -->
    <description>

      <!-- Those variables are substituted in the files above -->
      <!-- The order of variables is the order of the arguments of the function -->
      <variable-list>
        <!-- The definition of a variable -->
        <variable id="E" type="in" />
        <variable id="F" type="in" />
        <variable id="L" type="in" />
        <variable id="I" type="in" />
        <variable id="d" type="out" />
      </variable-list>


      <!-- The function that we try to execute through the wrapper -->
      <function provided="yes">external_code</function>

      <!-- the gradient is  defined  -->
      <gradient provided="no" />

      <!--  the hessian is  defined  -->
      <hessian provided="no" />

    </description>

  </library>

  <external-code>
    <!-- Those data are external to the platform (input files, etc.)-->
    <data>
    </data>

    <wrap-mode type="static-link">
      <in-data-transfer mode="arguments" />
      <out-data-transfer mode="arguments" />
    </wrap-mode>

    <command />

  </external-code>

</wrapper>
