<?xml version="1.0" encoding="ISO-8859-1"?>
<!DOCTYPE wrapper SYSTEM "wrapper.dtd">
<!-- author : schueller -->
<!-- date   : 2011-11-03 17:54:29 +0100 (Thu, 03 Nov 2011) -->

<wrapper>
  <library>

    <!-- The path of the shared object -->
    <path>poutre.so</path>



    <!-- This section describes all exchanges data between the wrapper and the platform -->
    <description>

      <!-- Those variables are substituted in the files above -->
      <!-- The order of variables is the order of the arguments of the function -->
      <variable-list>

        <!-- The definition of a variable -->
        <variable id="E" type="in">
          <comment>meanYoungModulus</comment>
          <unit>Pascal</unit>
          <regexp>E=.*</regexp>
          <format>E=%G</format>
        </variable>

        <!-- The definition of a variable -->
        <variable id="F" type="in">
          <comment>LoadForce</comment>
          <unit>Newton</unit>
          <regexp>F=.*</regexp>
          <format>F=%G</format>
        </variable>
      
        <!-- The definition of a variable -->
        <variable id="L" type="in">
          <comment>BeamLength</comment>
          <unit>Meter</unit>
          <regexp>L=.*</regexp>
          <format>L=%G</format>
        </variable>
      
        <!-- The definition of a variable -->
        <variable id="I" type="in">
          <comment>SectionInertia</comment>
          <unit>Meter^4</unit>
          <regexp>I=.*</regexp>
          <format>I=%G</format>
        </variable>

        <!-- The definition of a variable -->
        <variable id="d" type="out">
          <comment>Deviation</comment>
          <unit>Meter</unit>
          <regexp>d=(.*)</regexp>
          <format>\1</format>
        </variable>

      </variable-list>
      


      <!-- The function that we try to execute through the wrapper -->
      <function provided="yes">compute_deviation</function>

      <!-- the gradient is  defined  -->
      <gradient provided="yes">compute_deviation</gradient>

      <!--  the hessian is  defined  -->
      <hessian provided="yes">compute_deviation</hessian>

    </description>


  </library>

  <external-code>
    <!-- Those data are external to the platform (input files, etc.)-->
    <data>
      <!-- An input file -->
      <file id="file-1" type="in">
	<name>StdIn</name>
	<path>poutre_external_infile1</path>
	<subst>E,F</subst>
      </file>

      <!-- An input file -->
      <file id="file-2" type="in">
	<name>StdIn</name>
	<path>poutre_external_infile2</path>
	<subst>L,I</subst>
      </file>

      <!-- An output file -->
      <file id="file-3" type="out">
	<name>StdOut</name>
	<path>poutre_external_outfile</path>
	<subst>d</subst>
      </file>
    </data>

    <wrap-mode type="fork" state="shared">
      <in-data-transfer mode="arguments" />
      <out-data-transfer mode="arguments" />
    </wrap-mode>

    <command>poutre_files.bat</command>

  </external-code>

</wrapper>
