<?xml version="1.0" encoding="ISO-8859-1"?>
<!DOCTYPE wrapper SYSTEM "wrapper.dtd">
<!-- author : dutka -->
<!-- date   : 2008-06-26 13:50:17 +0200 (Thu, 26 Jun 2008) -->

<wrapper>
  <library>

    <!-- The path of the shared object -->
    <path>minimal_wrapper.so</path>



    <!-- This section describes all exchanges data between the wrapper and the platform -->
    <description>

      <!-- The variables are declared in the exact order of the arguments of the function -->
      <variable-list>
        <variable id="x1" type="in" />
        <variable id="x2" type="in" />
        <variable id="y" type="out" />
      </variable-list>
      


      <!-- The function that we try to execute through the wrapper -->
      <function provided="yes">smallest</function>

      <!-- The gradient is NOT defined  -->
      <gradient provided="no" />

      <!-- The hessian is NOT defined  -->
      <hessian provided="no" />

    </description>


  </library>

  <external-code>
    <!-- Those data are external to the platform (input files, etc.)-->
    <data />

    <wrap-mode type="static-link" state="shared">
      <in-data-transfer mode="arguments" />
      <out-data-transfer mode="arguments" />
    </wrap-mode>

    <command />

  </external-code>

</wrapper>
